{
  "protocol_version": 1,
  "type": "action.applied",
  "room_id": 1,
  "hand_id": 41,
  "version": 14,
  "server_time": "2026-10-27T14:03:09.481Z",
  "payload": {
    "action": {
      "player_id": "1",
      "seat": 1,
      "kind": "raise",
      "amount": 30,
      "timeout": false
    },
    "hand": {
      "hand_id": 41,
      "hand_no": 1,
      "button_seat": 1,
      "small_blind": 5,
      "big_blind": 10,
      "ante": 0,
      "bomb_pot": 0,
      "board": [],
      "second_board": null,
      "pots": [],
      "players": [
        {
          "player_id": "1",
          "seat": 1,
          "stack": 970,
          "bet": 30,
          "in_hand": true,
          "cards": [
            "7h",
            "2c"
          ]
        },
        {
          "player_id": "2",
          "seat": 3,
          "stack": 995,
          "bet": 5,
          "in_hand": true,
          "cards": [
            "??",
            "??"
          ]
        },
        {
          "player_id": "3",
          "seat": 5,
          "stack": 990,
          "bet": 10,
          "in_hand": true,
          "cards": [
            "??",
            "??"
          ]
        }
      ],
      "actor": "2",
      "legal_actions": {
        "can_fold": true,
        "can_check": false,
        "call_amount": 25,
        "min_raise_to": 50,
        "max_raise_to": 995
      },
      "complete": false
    }
  }
}
